{
  "$schema": "./config.schema.json",
  "storeFolder": "./store",
  "imagesFolder": "./images",
  "insta": {
    "instagram_id": "",
    "access_token": ""
  },
  "sessionService": {
    "url": "https://session.tyorka.com"
  },
  "publicSite": {
    "folder": "/var/www/tyorka.com"
  },
  "secret": "secret",
  "port": "3000"
}